{
  "artifact_type": "hyperray_validated_certificate",
  "schema_version": 2,
  "artifact_id": "validated-certificate.invariant.fixture",
  "certificate_id": "certificate.invariant",
  "certificate_kind": "safety_inductive_invariant",
  "proposal": {
    "artifact_id": "certificate.invariant.proposal",
    "artifact_type": "hyperray_certificate_proposal",
    "schema_version": 2,
    "certificate_kind": "safety_inductive_invariant",
    "sha256": "0000000000000000000000000000000000000000000000000000000000000000"
  },
  "validation_receipt": { "artifact_id": "receipt.invariant", "artifact_type": "certificate_validation_receipt", "schema_version": 1, "sha256": "0000000000000000000000000000000000000000000000000000000000000000" },
  "validation_policy": { "artifact_id": "policy.proof", "artifact_type": "certificate_validation_policy", "schema_version": 1, "sha256": "0000000000000000000000000000000000000000000000000000000000000000" },
  "trust_anchor": { "artifact_id": "trust.root", "artifact_type": "certificate_trust_anchor", "schema_version": 1, "sha256": "0000000000000000000000000000000000000000000000000000000000000000" },
  "validation_scope_sha256": "0000000000000000000000000000000000000000000000000000000000000000"
}
